<?xml version="1.0" encoding="UTF-8"?>
<playa xmlns:xsi="http://www.w3.org/2001/XMLSchema-instance" xsi:noNamespaceSchemaLocation="Playa.xsd">
	<personas identificador=IMOLJIM223 matriculaCoche=1234KNJ></personas>
	<sombrillas color="Amarillo">Hay 5 sombrillas amarillas <!-- Elemento mixto -->
		<sombrilla marca="Agatha Ruiz de la Prada" aperturaMetros="2"/> <!-- Elemento vacio -->
	</sombrillas>
	<chiringuitos></chiringuitos>
	<barcos>
		<barco tipo="Bombardas"/> <!-- Como es choice, o uno u otro -->
		<barcosMar cantidadBarcos="3"></barcosMar> <!-- numero dentro de un intervalo -->
	</barcos>
	<gabiotas nombre= "Las gabiotas blancas">5</gabiotas> <!-- elemento con atributos y contenido de tipo numÃ©rico -->
	<arena localizacion="Playa de la Caleta">
 		<longitud>450m</longitud>
 	</arena>



</playa>